{
  "$schema": "https://json-schema.org/draft/2020-12/schema",
  "$schemaVersion": "0.0.1",
  "$id": "https://raw.githubusercontent.com/smart-data-models/Candidates/master/standards/gaiax-ontology-v2111/models/InformationSecurityRiskManagement/schema.json",
  "modelTags": "GaiaX,Ontology,Legal,Security",
  "title": "Smart Data Models - Gaia-X Ontology - InformationSecurityRiskManagement",
  "description": "https://w3id.org/gaia-x/2.1.11#class/InformationSecurityRiskManagement. Legal document describing the risk management related to information security. Subclass of LegalDocument per the Gaia-X ontology, with no properties of its own beyond those inherited (url, mimeTypes, governingLawCountries, involvedParties); inherited properties are documented on the LegalDocument model and not repeated here.",
  "type": "object",
  "properties": {
    "id": {
      "type": "string",
      "format": "uri",
      "description": "Property. Unique identifier of the entity"
    },
    "type": {
      "type": "string",
      "enum": [
        "InformationSecurityRiskManagement"
      ],
      "description": "Property. NGSI-LD Entity type. It must be equal to 'InformationSecurityRiskManagement'"
    },
    "dateCreated": {
      "type": "string",
      "format": "date-time",
      "description": "Property. Model:'https://schema.org/DateTime'. Entity creation timestamp."
    },
    "dateModified": {
      "type": "string",
      "format": "date-time",
      "description": "Property. Model:'https://schema.org/DateTime'. Timestamp of the last modification."
    },
    "source": {
      "type": "string",
      "description": "Property. A sequence of characters giving the source of the entity data."
    },
    "dataProvider": {
      "type": "string",
      "description": "Property. A sequence of characters identifying the provider of the harmonised data entity."
    }
  },
  "required": [
    "id",
    "type"
  ]
}
