{
  "id": "urn:ngsi-ld:InformationSecurityRiskManagement:001",
  "type": "InformationSecurityRiskManagement",
  "dateCreated": "2026-08-20T10:00:00Z",
  "dateModified": "2026-08-20T10:00:00Z",
  "source": "https://docs.gaia-x.eu/ontology/v2111/classes/InformationSecurityRiskManagement/",
  "dataProvider": "Gaia-X AISBL"
}
